{
  "name": "Alice Johnson",
  "current_degree": "PhD in Computer Science",
  "target_university": "Stanford University",
  "target_department": "Computer Science",
  "research_interests": [
    "Natural Language Processing",
    "Machine Learning",
    "Large Language Models"
  ],
  "resume_highlights": {
    "education": [
      {
        "degree": "BS in Computer Science",
        "institution": "MIT",
        "year": 2020
      },
      {
        "degree": "MS in Artificial Intelligence",
        "institution": "Carnegie Mellon University",
        "year": 2022
      }
    ],
    "skills": [
      "Python",
      "PyTorch",
      "TensorFlow",
      "Natural Language Processing",
      "Deep Learning"
    ],
    "research_experience": [
      {
        "title": "Research Assistant - NLP Lab",
        "description": "Developed novel attention mechanisms for transformer models",
        "duration": "2021-2022"
      }
    ]
  },
  "preferred_graduation_duration": 5.5
}
