{
  "name": "Jane Doe",
  "current_degree": "PhD in Computer Science",
  "target_university": "Stanford University",
  "target_department": "Computer Science",
  "research_interests": [
    "Machine Learning",
    "Natural Language Processing",
    "Artificial Intelligence"
  ],
  "resume_highlights": {
    "education": [
      {
        "degree": "MS in Computer Science",
        "institution": "University of California, Berkeley",
        "year": 2022
      }
    ],
    "skills": [
      "Python",
      "TensorFlow",
      "PyTorch",
      "Research Writing"
    ],
    "research_experience": [
      {
        "title": "Research Assistant - NLP Lab",
        "description": "Developed transformer models for question answering",
        "duration": "2021-2022"
      }
    ]
  },
  "preferred_graduation_duration": 5.5
}
